<!ELEMENT acquisti (acquisto*)>

<!ELEMENT acquisto (username, date, totale, articoli)>
<!ATTLIST acquisto
    id CDATA #REQUIRED
>

<!ELEMENT username (#PCDATA)>
<!ELEMENT date (#PCDATA)>
<!ELEMENT totale (#PCDATA)>

<!ELEMENT articoli (articolo+)>
<!ELEMENT articolo (nftId, prezzo, quantita)>

<!ELEMENT nftId (#PCDATA)>
<!ELEMENT prezzo (#PCDATA)>
<!ELEMENT quantita (#PCDATA)>

